user,review,rating
Willem van Heerden,"A couple of annoying bugs have crept in recently, and it's impossible to report these problems. This is unacceptable for such a widely used app. When certain contacts change their numbers, a new chat is started. The old chat indicates that the number has changed, so the app knows there's a connection between the numbers, but won't merge the chats. On the Pixel Watch 3 one can choose to not receive notifications while the phone is open. This works in every app except WhatsApp.",1
Oscar Q,"I was really hoping for a smooth messaging experience, but WhatsApp has been a letdown. The app frequently crashes and the notifications are inconsistent, which makes it frustrating to keep up with conversations. Plus, the user interface can feel cluttered at times. I also have concerns about privacy and data security. Overall, I expected more from such a popular app. Time to look for alternatives",1
Mike Moritz,"Updates always break functionality while adding ""features"" nobody asked for. Updated Feb2025. WA now opens a menu of file types when attaching something. Before you could just pick what you wanted. It doesn't display all my albums when sending pics. Long pressing the ""gallery"" file type opens my photo gallery but it's buggy and slower and doesn't display mp4 or all of my gifs like it did before. I now have to share my files from my gallery app to WA as a work-around. I dread their updates.",1
astroturtle,"FIX THE BUG THAT FORGETS YOUR LOGIN AND FORCES YOU TO RESTORE EVERYTHING. On every device, ""You have been logged out"" without ANY reason. And how is it possible to have WhatsApp set to ""daily"" backups, and then the most recent backup is from over a month ago? A month of messages, images, docs, videos, just gone because your app can't even do a BASIC BACKUP properly. Garbage app. The only reason I keep using this thing is because other people.",1
A Google user,"I noticed that recently after updates, when listening to voice notes, if it's a long voice note the voice note will stop when the screen goes off. Dunno why it's doing this. Before it wasn't like that. Also noticed that missed calls are not shown on screen, but only when you open WA and check you chats you will see the missed call label inside the chat. Please work on a feature that allows you to block Whatsapp video/ calls in general or for a scheduled time.",2
Alexius Emejom,"Very easy-to-use UI. I am not a fan of the latest updates to the Status updates interface that is displayed horizontally. I prefer the original vertical display for the status updates. I wish WhatsApp could revert to that view. Also, maybe the communities could be organized on another tab to free up space for status updates.",4
Imad Nassar,"Excellent app overall but I'd like to point out an option that should be improved . I noticed that when recording a voice message , the sound is not that clear and crisp compared to Facebook messenger . When I record a voice message on messenger , the sound is so clear unlike when it's on WhatsApp . Please improve voice messaging sound quality and thank you.",4
zahra,Love WhatsApp but there is a glitch that is very annoying. When I scroll ust a little bit up it jumps up hours earlier randomly. It happens very often and is confusing and annoying. Please look into this! Also please have a feature to disable or lock the video message feature because when scrolling it gets clicked on accident and is very annoying,2
hu trillz,"Just started using the app and I'd happily give 5 stars if it were solely based on the product's simplicity design, and operating abilities, however I'd like to make 2 (obvious) suggestions. 1. Being a translate feature and perhaps have in settings a setting to set your preferred translating language. Also, on the topic, many prominent websites are offering live video call translating capabilities, might be worth considering. 2. A more clear account/profile accessibility button/page/feature.",4
Denise Martinez,"Fix This Bug: Having issues with accessing the gallery on my phone. App has access, but my albums do not show up in the option to send photos. Can't see all my photo/video albums Currently, when I try to share a picture or video on WhatsApp directly, it doesn't let me see all my folders. Many other users are having the same issue. I have uninstalled and reinstalled the app multiple times.",2
Sarah Estes,"I have been trying to get my account unlocked after it was (as admitted through the review) mistakenly marked as spam. Yet it has been over 24 hours and I can't even login. I was given no warning, suddenly a message just appeared saying I wasn't allowed access. I've tried multiple times to get in touch. The one time a call actually came it hung up before giving me the verification code. You made a mistake, you need to fix whatever is going on",1
Clif Jackson,Works great only don't think that is what's app or even your internet that's causing you're connection to be slow or be dropped... It's very much got too do with your actual phones intenna more than anything else I wanna say... So if it's been over 6 months since you've bought or upgraded... Then your gonna have issues.. Once again not the actual app or your internet provider but your phone that's a POS. Almost like they made them to do that before long??? App works great overall!!!!,4
Sean,"Jesus christ, app developers: stop changing things people use every day for no good reason. Don't move the button to attach photos from the gallery to the opposite side of the screen, so now I reflexively keep hitting ""attach location"" or whatever. Don't make it so the slider sometimes refuses to appear and I can't quickly scroll back through photos from a long time ago. It worked fine. Leave it alone.",1
Corey Hernandez (Parkorey),"Have been using app for years. It was fantastic initially, but lately the quality of the app has gone way down. Calls have been dropping more and more frequently. Video quality has become very pixelated. App has been glitching and saying I decline peoples calls when I never declined them, most times phone won't even ring and I'll have half a dozen missed calls all arrive at once. Shame, was a great app for a while. Hopefully they can fix all these glitches, but it's been like this for months.",2
Dino Bettini,"They removed the ""show notifications"" option when muting a group. This is such a downgrade. Also, the limits to sharing and forwarding messages are horrible. Edit: Also, similar to Instagram, their features are so full of bugs that it seems only interns work on them. Restoring the chat history on another phone always fails after getting to 97%. Lost an entire day trying it.",2
Ruben Sanchez Gonzalez,"Since meta bought this app, it has been declining both in quality and functionality. Vocie messages. If you leave a draft, a lot of times you'll lose your message. If you pause while recording a voice note, it stops preventing the screen from turning off, so it interrupts your message. Is there are 2 or more voice notes to be played, you can't just play one, leave the app to do something else, and keep auto play the rest. It just stops. All in all, quality worsening each day.",2
Yoel Teitelbaum,"This is the worst app when it comes to switching devices. There is no one to talk to except an AI that keeps repeating the same useless response over and over. It's a shame that, in this day and age, the process is so complicated, takes so long, and still ends up failing. It's time for real investors to take over and fix it."" my advice if you need this for business don't touch it use some alternative messaging services there are plenty out there",1
Tanaka Magos,"""Amazing! WhatsApp has revolutionized the way I communicate with friends, family, and colleagues. Its seamless and intuitive interface makes it effortless to send messages, share media, and make voice and video calls. The end-to-end encryption ensures my conversations remain private and secure. With its cross-platform compatibility, I can stay connected across devices. WhatsApp's constant innovation, such as its disappearing messages and group chat features, keeps",5
Sandy bind,"For what I use it for at work, the app works fine. But when I had a problem with my number being banned after I tried to move it to a new phone, I got no response from Whatsapp. So gave up and adjusted at work. But on a whim I tried to download the app again after a month and a half...and it downloaded and works just fine. So...the app is fine as long as you don't have a problem! And just maybe, if you give it time, your account will reset.",3
Nick Noyce,"the perfect replacement for SMS! The only annoying thing is the lack of any kind of housekeeping function, I'd like an option to be able to clear down old chats to keep most recent chats, to do this manually would take ages, my backup size is large because of this but I don't want to clear whole entire chats as I like to have at least the last few months to refer back to.",4
Lucius I.,"Beware! Please read! I recently noticed pictures that I did not download on my phone- lots. I thought that maybe I had synced my account with my daughter's. Nope. So I researched it. Turns out apps can download stuff onto your phone. WhatsApp has been not only downloading pictures to my phone but accessing my contacts, my music and audio, and my phone calls in the last 24 hours. I have to use this app for school or I would delete it but I have revoked all permissions.",1
Damilola Akinwumi-Oke,"Your updates are too much too unnecessary sometimes and you only focus on updating the phone version. What happened to the laptop WhatsApp version? That hasn't been updated in a while. There are no ""Favorites"" section on there. Or even lists. Do better. Also, would it be too worrisome to y'all to increase the number of chats that can be pinned??? 3 is just too 2019. Update that. Very necessary.",3
kevin whisenant,"Unfortunately, I can't send msgs from my watch. I receive them fine but when I reply, they're stuck pending with the clock icon. They'll only send if I force close the app and open it up again. But lately that hasn't been working either. Loading voice msgs often times gets stuck spinning and never loads. I have the LTE version and everything else works fine. No issues on my phone. This happens whether I'm on WiFi or LTE. I've tried uninstalling, restarting, force closing. Nothing fixes it.",1
Mwape Chimpampa,"I really like the app. It makes things so easy. But I still have some suggestions, not really complaints. I really think that it would be good for a feature to be added for people to copy the text on their status post, so that if they typed anything wrong, they can copy, delete, paste and make the minor edits needed instead of typing everything all over again. And if another feature to allow one to change to view once anything they forgot to send as a view once by a simple tap, that would be 👍",4
Roman Abreu,"There's a very annoying voice messaging bug that has been going on for months where for some reason the volume is so low that even at max volume you can barely hear them. Initially I thought it was my current phone but recently I've received voice notes from iPhone users with the exact same issue, and it's not only annoying but dangerous as sometimes one can forget to lower the volume before playing something else. Please fix it!!",1
Lavendeer 201,"Custom stickers are a pain, gifs need to continue playing, and the latest update is awful for photos! I used to be able to see all my albums, but now I can only select from Downloads, Camera, Screenshots, and other preselected albums. This makes it VERY DIFFICULT to find the things I want to send to friends and family. Additionally, the typing and correcting spelling is very glitchy/frustrating now. Besides that, it's great for communication without cell service, and is much better than SMS!",3
Lantis XT,"I do love this app, but there are two glaring issues. I communicate with my partner overseas using this app, but the send button for video messages is directly next to the ""1"" button, and it's extremely easy to accidentally hit the ""1"" button. Very frustrating! The second issue is the autoplay. I'll listen to a voice memo ans try to respond, and it'll autoplay the next message, playing over what I'm trying to record. There really needs to be a setting to turn off autoplay. Other than that, 👍!",2
Bobbie Cole,"Finally found the hidden list bar at the top. I found that I had to swipe down in order to see it. Why is it hidden in the first place? It should be shown as default! ... *App could use ""scheduled messages"" to send a text later in the day. ... Also could use the ability to pin more (up to 8) conversations to the top. ... *Ability to have photo albums shown in alphabetical order would be best for faster searching for photos to attach to conversations.",2
Henry Ofori,"WhatsApp Messenger is good 👍🏼 for communication from all locations. It helps to forward images, files, documents, and other links to help reach more people and set plans for your support. The main difficulty it shows when making a call is: ""connecting/reconnecting"", which I think is from the network. When this statement shows no voices are heard 😒, either you called or you're receiving a call from others. It's great 👍🏼 in sharing current status and chatting with families and friends 🧡.",4
Reinan Mortiz,"The chat is good, but for video calls the volume control is frustrating since it does not allow for precise settings. The lowest call volume setting is still loud enough for everyone around to hear. The app also does not allow for listening to music through Spotify or multitasking like that while on a video call, which is also something I hope could be updated in the near future.",3
Clara Cherif,"as much as it is the app I use most, there are a few annoying glitches I get. for instance, I still didn't get the meta AI. all the ppl around me did and I didn't, even though I'm all caught up on updates. there's also this thing on the desktop wp where every open once message I send appears as if its sent by the recipient. I already texted WhatsApp support about it last week and sent screenshots. I'm waiting for the problems to be solved. other than these everything else is perfect.",4
Sebastian Fuller,"They just made the worst possible UI update. Before if I wanted to send a photo, it would just show ALL the albums in my gallery on the app to select and send. Now, it ONLY shows recents and my cloud stored albums. And there's no way to access or view my other albums not in the Google cloud, in the app. So I have to go to my gallery, find the photo, and then ""share"" it to the chat in whatsapp. Why they made this awful change? I have no idea. It worked perfectly fine.",3
Connor Mahoney,"It's a messenger app I primarily use for its voice message feature. The voice messages portion is a hot mess. Sometimes the app tries to route the audio to the headset speaker instead of the normal one. Sometimes it'll black out and lock the screen while playing, which forces you to restart the whole message. Sometimes your recording is interrupted by a text or app popup, requiring the whole recording to be redone as it drops the whole voice message entirely if you didn't finish it. Hot. Mess.",3
Connor Hawke,"Gone. WhatsApp suddenly lost all my messages. It wasn't even open. One day I opened the app and it said it would try to restore my chat history from backup. It failed. Many others have had the same issue; search Google. The fix to get some (but probably not all) of your data back is long-winded and may require rooting your phone. I'm no longer using WhatsApp. Also: critical bugs on Android, including missing messages/media in exports. Customer service is either AI or illiterate. Use another app.",1
Carl Kemp,"So why exactly is it that you STILL haven't mastered the arcane art of editing text messages on Android??? Everybody else seems to have it down pat. At least half a dozen times, I have tried to edit a message that I sent, only to have my edits disappear as soon as I confirm them! Seriously, why even offer an edit feature if you have no intention of actually implementing it???",2
RESJ Robinho,"Hello, though the app is perfect in all its features, it would be a nice thing to be able to highlight chats (highlighted chats appear on top, separated from other non-highlighted chats by a line). And also, the voice message feature will sometimes bug out and make the screen go black for a few seconds. The audio also lowers when this happens, difficultating the use of voice messages.",4
Perry Bdg,"""I've been using WhatsApp for years, and it's been my go-to messaging app. I love its simplicity and reliability. The voice call feature is particularly useful for staying in touch with friends and family abroad. However, I've noticed some occasional lag when sending files. Overall, WhatsApp is a solid choice for anyone looking for a hassle-free messaging experience?.""",5
Mubarik Hanif20,"WhatsApp is an amazing messaging app that keeps me connected with friends, family, and colleagues effortlessly. The interface is simple, user-friendly, and the voice/video calling features are clear and reliable. I love how it allows me to send messages, share media, and even make group chats without any hassle. The end-to-end encryption makes me feel secure, and the regular updates keep improving the overall experience.",4
Rafael Sarante,"The new system to share photos and videos is so tedious. I have a lot photos and videos on my phone organized by album so I can locate them easily and the new system implemented by WhatsApp takes a lot of time to get to the album option. First show the most recent and then we have to tap Recently for it give us some of the albums, but if it isn't the one you're looking for a wait is due so the See More option pops up and that takes so long and have to mention the extras steps now.",3
Antonymous User,"Great app if you have wifi and need to pop off a few text messages but if you use it to make a call, prepare to get frustrated and angry. You'll get about 30 seconds before either you can't hear them or they can't hear you. This ""feature"" is worthless and shouldn't be advertised. I don't want any ""get ahold of so and so to help solve the problem"" I just want it fixed",1
Thurman Yates,"The user interface is awesome. But, I can't use it for much because I can message only message people that are also on WhatsApp. So, 2 people out of all my contacts. No one else wants to use it for that exact reason. It would be so great if it could be used as the default sms/text app for my phone and I could send and receive messages from anyone whether they had WhatsApp or not.",1
Jessica Clark,I used to use this app almost exclusively for messaging however after the latest update it has become intensely frustrating to use and is very glitchy. Voice to text is almost useless now and trying to edit a dictated message isn't possible. It simply highlights 1 word and does not allow anything to be done after that until it closes out the message and makes you start completely over. Hopefully they fix it eventually.,1
vintage rain,The new update changing things with the ui makee the app more difficult and annoying to use. The format and shape of things does not have to be changed. Today I saw the gallery option only accessing a very small number of my photos making it much more difficult to access and send specific images. I hope the ui goes back to the previous one because it worked much better.,3
Ilovelosangeles,"The LAST SEEN is not working for the past week! It even shows the wrong date & time for myself. I've uninstalled/reinstalled. I looked for updates; I'm using the latest version. I restarted my phone several times. Also, my phone is new, Android 14. This app started this issue last week. Until then, there were no issues. Also, people are reading & replying to my messages, but my ""two gray checkmarks"" on my messages are not turning blue and yes, we all have ""read receipts"" turned on.",1
Michael Eiland,"Very unhappy. For some reason when choosing a picture to send in a message, of all my albums in my gallery, only 5 are visible to select from. This was never the case before up till now. I only can select pictures from camera folder, recents folder, downloads folder, whatsapp and screenshot folders. If I click the 3 buttons top right only cloud apps is there. This means if I have a picture in another folder I have to transfer it to one of these to be able to send it in whatsapp. Permission on",2
Max S,"New updates makes the screen sooooo congested. A search bar suggesting I ask if Mars has life: WHATS hAPPening?? It's a messaging app, what was wrong with that. This was once a great piece of tech that cost a few bucks a year. It's like having a crazy uncle or something just renovating stuff for no reason and the changes just get worst and more confusing. Update. Only getting worse. The text field is now so broken you can't move the cursor with out the app losing its mind. Adding photos is broke",1
Homayoun Yousefi'zadeh,"Chat customization introduced recently is great. But in the latest version, the green accent color in the chat list (used for buttons, highlights, and some UI elements) is not directly customizable through settings. Please add color customization to the chat list as well.",4
Petu Pullo,"The new updates are HORRIBLE. After the new updates, everything on the app ahs become so much more difficult to find. They moved around where for example attaching images happens, so I keep jumping to the contacts app. A new feature is the bubble that pops up instead of the ""is typing..."" On the top of the screen, and it is the one thing that I absolutely disliked about Messenger, so why do they need it here? It brings 0 extra value and is distracting. Very disappointing.",2
Sidra Siddique,"From my point of view, WhatsApp is a fantastic messaging app that makes it easy to stay in touch with friends and family. I appreciate its simplicity and the ability to send messages, share photos, and make voice or video calls for free. The end-to-end encryption gives me peace of mind about privacy. However, I also see the downside of constant notifications and the pressure to respond quickly. Overall, I think WhatsApp is a great tool for communication, as long as it’s used mindfully.",2
Danish Syah,"Emoji button is gone from the text status option. Why is that this app's update always makes it worse than before. I get that you did make an improvement (unnoticeable as always), but the things that has been removed or changed not to the users liking always sticks out the most. And one more thing. The web version should at least make text status. People who works 24/7 on their PC might need to use that anyway. And now somehow my contact isn't linked to this app",2
Joy Rose,"The new update has made it a frustrating process to try to upload videos or pictures, even finding the albums has been made more difficult. The edit and autocorrect features for text are very buggy, as well as voice messages or even phone calls. Not to mention all the spam groups I get added to and the spam calls I get. It just seems to get worse over time when this could just be a simple messaging app.",1
Varun Setlur,"On my Pixel 9 pro running Android 15, calls get muted when switching apps or locking the screen. The other party cannot hear until I switch focus back to WhatsApp. This makes it nearly impossible to use my phone for multitasking during long calls. I've granted all permissions and disabled battery optimizations, but the problem persists. I do not have this issue making regular phone calls, which I'm doing more of now.",1
Dennis Mikhail,Why is it so difficult to fix this app? It should not stop playing voice messages whenever a shadow comes across the light sensor on the phone I don't understand why that's even a built-in feature there's absolutely no use for that. On top of the fact it likes to pause while you're recording and sometimes records and other times doesn't. Doesn't seem like very big issues to fix so please do so.,1
Henry Carm,"Pls, can you stop changing and removing file properties when i want to send a song by ""audio"". im forced to send it through ""documents"" And The Max Character limit for paste is too small when editing a media on Mobile, i wanted to paste all the lyrics under the media to reduce message count but no... i have to send them seperately which reminds me, when i forward a document upload (like .mp3) with its long captions, it only forwards the song, without the captions like, WHY",3
Joe DeBellis,"i have been concerned that when I lost my primary phone in the lake and started using this cheap give away tablet, someone or something installed a keypad and session mirroring app. very weird stuff has been happening. as I am typing there is. lag, sometimes letters are backspaced over making the word misspelled, and I now have to click twice on certain actions. Plus pictures and video of me, mostly from the front facing camera appear in my folders. when I check the meta data, like location,",1
Nils M,"The photos sent from this app keep saving on my gallery. It's a nuisance. I have to keep manually deleting them. To add to this nuisance, the app keeps asking about saving to Google drive or something else. Why not save in a temporary app folder like most apps do? Or at least make that an option... I literally loathe opening this app, and I loathe getting memes. I use the app cuz some family and friends overseas are on it, I wish they were on some of the other better communications apps.",2
