user,review,rating
Meshack Jolly,The app is now very slow when uploading photos and videos to status and when sending to contacts it's so annoying and frustrating. It wasn't like this before this recent update. Please the problem should be fixed on time. It has disrupted so many things In case of emergency I can't send photos and videos to contacts and status it goes blank and loading for a very long time without going through. It's so frustrating and devastating. The recent update is good but VERY SLOW. Please work on it.,1
J De,"The new (as of early 2025) ""gallery"" interface is bad. It used to let you pick from the phone's stock gallery (Samsung), which gave easy and sensible access. Now it's a subpar custom interface. Bad in its photo mode, and even worse when it sometimes requires you ultimately, when it's not from the first few photo folders, to pick using an Android stock FILE manager.",2
James Gibbons,"This is a review for the latest Android version: This app used to be good, now it has a couple of issues. I don't like the new bubble that says when someone is typing, why can't I just choose for it to say a person is 'typing'. The most annoying bug is if you have typed out a long message then want to attach an image, when you go to add the image it loses everything you have typed. You need to remember to add the image(s) first, then add your message as a caption, WHY?!?",3
Ali Raza,"WhatsApp is an excellent communication app that’s easy to use and highly reliable. Its end-to-end encryption ensures privacy, and features like group chats, voice notes, and video calls make it versatile for both personal and professional use. However, it could improve by introducing more customization options and better storage management. Overall, it’s a must-have app for staying connected.",4
Michelle Duong,Change the UI back to November 2024. There is no need to have a dedicated text box when attaching media. It's also very annoying how the message is deleted if you type it first (in the regular text box) and attach a photo afterwards to send. Just reverse it. This is a change that is not necessary and makes the experience less practical.,3
Allen Sunil (Alien),"It’s absolutely maddening that this glitch has been around for 5-6 months without a single fix. Every time I listen to audio, the screen goes into sleep mode, and I’m completely stuck. I can’t pause, adjust the volume, or do anything until the audio ends. It’s beyond frustrating that something so basic is still broken. Do the developers even care? This issue disrupts everything and makes the app unbearable to use. Fix this now—this level of neglect is unacceptable and exhausting!",1
Ini David,"Since I installed the update, uploading pictures to my status and sharing to contacts has been a huge problem. Videos takes forever to upload and the status update is just scattered. Now, status aren't updated according to time. It's so annoying. For 2 days now, I haven't been able to send pictures or upload them on my status. You guys should look into it.",1
S,What is with the new update?!If you're attaching a photo to a message the original message is lost. Have to retype the whole thing just in a bizarrely bad editor? Why is the add-caption editor now so different to the normal message editor? Why can you not paste text into it? Why can you not move the cursor without a weird magnifying effect that actually makes it almost impossible to get the cursor where you want it to be? What a mess.,1
New Generations,"1. After the call is connected and within 10 seconds I get a poor connection error every time. Every time I get this poor connection error, after some time I am able to get back to the call automatically. This happens every time. This is a big bug. 2. Photo sharing, no photo preview show. Only dark screen visible. Unable to crop photo due to black screen.",1
Robin Penny,"When you attach a picture to a message u r writing, WhatsApp throws away the message without warning and just sends the picture. Very annoying if you have written a long message! Also unable to find a way to select a picture from alternative folders (I had created a folder called Pictures under DCIM). I think it's using it's own media viewer. Couldn't find another way to report problems - so doing as a review (The Report bug option is currently missing from Settings)",3
Mike Yag,Unfortunately I have to use WA because some of my clients do. This is the worst messenger ever written. Absolutely inhuman interface and total absence of logic behind it. Worst backup system in the world. Worst organized access to media files. Whatever you use is an example of how NOT to do this function. I would be happy to give it ZERO stars but have no option. If you can afford not to use WA don't use it. Anything is better than it.,1
JOEH SPARTAN,"WhatsApp automatically updates its database and other vulnerable files on my device, causing it to work slowly, consume excessive storage space, and potentially expose my device to viruses and malware. Additionally, I've noticed that around 100 unknown stickers have been downloaded to my device, despite not having any stickers pack installed. Even after deleting files, the problem persists, affecting the app's performance and compromising my device's security. Please fix this.",2
Adepoju Oluwadunmininu,"I love using WhatsApp, but I think it would be amazing if I could edit my status updates after posting them. Sometimes I catch a typo or want to add more context, but currently, I have to delete and re-post.Having an 'Edit Status' feature would greatly enhance the overall user experience, allowing users to quickly correct mistakes or update their status without having to re-post.",3
Winston Mwamande,"I love the text 'edit' feature after you send a text. So here is an idea, instead of long pressing the specific text... Why not just allowing a person to tap the text 4 times. Like how when you want to tag a message, you just swipe the text bar right. Also, this new update is taking way longer to upload a media file when sending it.",4
Muneera Sheriff,"Overall, it's a good app, but there are a few things that could be improved. One key request: please enable the View Once option when selecting multiple images or videos to send. It would make sharing private content more convenient. Also, about the Last Seen privacy settings—if Y has turned it off for X, but X hasn’t done the same for Y, why restrict Y from seeing X's last seen? Let each user’s privacy settings work independently instead of playing judge in the middle! 😂",4
Temiloluwa Olaoya,"I don't like the new update where status updates of people I frequently chat with are moved to the top. It's so annoying, confusing, and makes everything look scattered. Since updating yesterday, I can't send pictures to anyone or post pictures on my status. The screen just goes blank, and I have to exit WhatsApp and reopen it. Please fix these issues urgently! Update: it's now back to normal, but kindly add the feature where we can add emojis back to the text status update😊👍",3
squishy tomato,"App has become UNUSABLE since a couple of weeks..Seems to have a bug with sending messages - sometimes when you hit send, there is a red exclamation mark for a second, then the message appears to be sent but when you leave the chat and reopen it the message has disappeared. Impossible to sustain a conversation now. I have updated my phone software and run a scan for malware, I don't think the problem is on my phone. Tried to contact WhatsApp but only got an automated reply. Very frustrated.",1
Abhay kumar,"Earlier, when I tried to call someone on WhatsApp who was already on another call, it used to show a message like ""The person is busy on another call."" This feature was really helpful because it let us know the person was unavailable. Now, this message no longer appears, and it just keeps calling even if the person is on another call. It’s confusing and makes it harder to figure out if the person is busy or not. I really miss this feature and hope WhatsApp brings it back. It made things easy.",3
Anna Rebeka Majzik,"DO NOT UPDATE!! 1) If you write your message first and then add a picture to it, it doesn't send. I literally had whole paragraphs disappear after attaching a picture. 2) can only see 7 gallery folders. The ""see"" more option isn't always visible 3) Attaching pictures: previously, you just clicked on the big green button after selecting the pictures you wanted and you could customise your messages after. Now they added a tiny edit button across the screen. 4)the typing pop up bubble is annoying",1
Bee A Unicorn,"It's a great app and all, I use it for my primary communication...but I must say the audio quality is trash, when I upload a picture or video on my status, the quality is trash and the video call quality is also trash. Also, notifications of new messages are inconsistent and sometimes show up 5 minutes after the contact has sent the message. Nevertheless, it's my primary messaging app and I wish the media quality was tip-top, otherwise the app is great.",3
Marvellous Chukwukelu,"You guys made a feature that allowed me to have the account for two numbers. When I switched so that I could have it on the same phone, you erased the entire history for a number I have had for years. Your automatic backup doesn't work. I have to keep doing it manually. You don't send notifications for both accounts. No matter how many times I change the settings, you always stop sending the notifications for one of them and I don't realize that I am missing messages en masse. I hate this app.",1
Zuni,"If we talk about seen1 SMS, then this is a great feature of WhatsApp, but one problem that has been recurring and which has killed the purpose of this feature is that receivers are misusing this feature by taking pictures of their screens, so I think it is necessary to introduce an update that when an SMS is sent on Scene One, your profile picture or something similar should not be visible as well as that shows who sent the message. Thank you.",1
Kursin,"Dear Meta Team, I'm providing feedback regarding the AI memory limitation. The current limitation makes it difficult for me to have continuous conversations. I suggest improving the AI's ability to store long-term memory. I suggest enhancing the AI's memory to: 1. Store user information during the same session. 2. Recall previous preferences and topics. 3. Enhance learning and adaptation capabilities. These updates will significantly improve user interaction. Thank you.",3
Somesh,"I noticed a few bugs recently that spoil the user experience. 1. When I edit a message and exit the chat, I still see the old version of the message instead of the updated one. 2. Sometimes after sending a message and leaving the chat, the other user's reply appears as the last message instead of mine. However, when I reopen the chat, my message is displayed as the most recent one, which is a significant bug.",1
Ashok Jhawar,"Recently the emoji tab at the time of writing in status has been removed. It was very helpful. Secondly, the status is the only verticle, where not so much improvement took place. We can't reduce or increase the size of fonts on our own, the type of fonts are very limited, the colour of fonts is also single i e. White only. All these should be taken care of.",4
Sky,"This is my first and last review for this app. I have one problem. Before the update It was possible to clear WhatsApp data by simply going into settings and clicking ""clear data"". Now it's not possible with the recent update, which makes it really frustrating. Now it takes me into a a weird screen when I click ""manage storage "" which was replaced for ""clear data"" . Honestly, it's stupid idea. Now I have to reinstall WhatsApp everytime I need my data to be cleared for personal reasons.",1
Naglaa Kamal,"The last update is very bad, now when I try to attach any photo I have to search through everything as they appear as recent, when I hit the folders tab and choose any photo it won't attach and kicks me back to recent folder. Also the edit option isn't clear like before. You are improving the app or messing it up. Also what is that option of AI ?? I don't need any AIs. Stop what you are doing to ""improve"" as actually you are screwing it and get everything as it was.",1
Sqweebo,As many others have pointed out this app is not as good as it once was. How do they managed to 'develop' the app and just ruin it? Just created a long message to accompany a photo. When editing the message it becomes impossible to edit. Starts enlarging and deleting text . I couldn't get out of it until it eventually deleted all the text I had typed. I know there are cutbacks everywhere these days. Seem they got rid of their developers too!,3
toyin olakehinde,"WhatsApp has always been an amazing app ever since I started using it. It's reliable and user-friendly. However, after updating to the latest version, I’ve encountered some frustrating issues. Sending pictures, receipts, or posting photos on my status and contact list has become very stressful. I can’t access these features properly anymore. Please look into resolving this issue. Aside from this, great work on the app overall",1
Brembo Jefe,"It's a good messaging app to keep in touch with friends and family. However having a diverse amount of people that I chat to and post status updates for... it becomes tedious to always select which contacts can view my status updates, as sometimes the content may not be appropriate for everyone I chat to. I then suggest having ""status groups"" where I can easily select which group of contacts, can view my status updates depending on the content that is posted.",3
Olamilekan Ayinla (Olami),"WhatsApp is hands down the best messaging app out there! It's fast, reliable, and packed with amazing features like end-to-end encryption, voice and video calls, group chats, and seamless media sharing. The user interface is simple and easy to navigate, making communication effortless. With constant updates and new features like disappearing messages, multi-device support, and communities, it keeps getting better. Whether for personal or business use, it’s the go-to app for staying connected.",5
David Bosch,"5 Stars until you fix the issue that always says: ""The download could not be completed. Please..."" when looking at statuses from my contacts that are videos. My internet connection is superb. Please change it because it is freaking annoying. I alwayw have to tap forward and then back and then it MIGHT show me again this error and i can repeat it until I get so annoyed that I leave the status. Also, I cannot screenshot any profile pictures anymore. That is so annoying.",1
Pietro Panino,"23-12-2024 update It could be another great improvement choosing for every single media in a chat to be saved or not directly along the chat itself, maybe putting a botton just next to the media (""save yes/no""). This can make possibile to see the preview of the media without removing it from the chat sight. It's so frustrating having phone memory always full because of a lot of useless media that could be used only for the time they are created. Efficiency, speed, modernity. Thank you.",5
Tehreem Umar,"""Hello WhatsApp Team, I love using WhatsApp and enjoy all its features! However, I'm facing an issue with setting up two-step verification. Despite multiple attempts, I keep getting the error message ""You cannot set up two-step verification. Try again after a few hours."" This issue has been persisting for several days. I would appreciate it if you could look into this matter and provide a solution.",2
C A,What happened to attachment options with the recent update? I can no longer access my folders in the gallery. Only have access to recent photos which means if I want to attach a photo I have to scroll through all the recent photos in order to find it as opposed to having the option to go through my gallery and see the different folders. Really frustrating! I've stopped using WhatsApp because of this.,1
Noman Akhtar,"Dear what's app. Previously, when sending a video during a conversation, the process was quick and seamless: selecting a video from the gallery would immediately prepare it for sending. However, with the latest update, an additional step has been introduced. After selecting the video, I now have to click on the thumbnail in the bottom corner to confirm before it’s ready to send. This change interrupts the natural flow of conversations, especially when sharing videos quickly. Thank U",5
Divine Dan,"WhatsApp has been amazing with each update. That notwithstanding, the inability to search keywords in text even after using the search button is causing a whole lot of trouble. I have to go all through the chat to find a single line I'm looking for. Amidst other requests, please try to look into this one as it is very pressing. Thank you, but after all, WhatsApp messenger still is the best. For this reason, I'll give it a 4-star until the issue has been resolved. Thank you so much Team WhatsApp",2
Gregory Pippas,"Latest update is a massive downgrade for attaching media. Defaulting straight to a whatsapp specific ""recents"" folder rather than loading the standard gallery where albums are. It now takes multiple presses to get to my albums where it only took one before. You can also no longer hold and swipe to select multiple pictures. Being forced to select the dot in the corner. Which is easy to miss and you end up opening the picture rather than selecting multiple pictures.",1
Isabella G,"Very good as i use this all the time and had it for the past 4 years! About a week ago though it turned my front camera on the app weird and i have been unable to fix it, sacrificing all my messages to uninstall then install it again and it not work. I am quite disappointed about that as i dont have a way to fix it. However now that i think about it, its been since the 16th December update, so could be a bug.",4
Ingrid Tandou,"Since a week ago until now I still have trouble sending image/photo/video directly from the gallery, the screen display is completely dark and the cursor keeps spinning, like it's hanging. Either it took 10-18 minutes or totally failed. But there's no problem for forwarding image/photo/video received to other WA recipients. Now I just found out that infact I also can not send audio file via this WA. Can you please fix this problem a.s.a.p ?",2
Jawad Niazi,"Dear WhatsApp Team, I’d like to suggest an enhancement to media visibility settings. In group chats, I often receive images, videos, and audio files. While I want images and videos visible in my gallery, I prefer audio files to remain hidden in my file manager, as they clutter storage and require manual deletion. Currently, media visibility applies to all file types, which limits control. Adding separate options for images, videos, and audio files would make file management easier and improve ☺",4
oluwafemi adekunle,"My God! This is one of the worst update I've seen in recent. Ever since I updated recently it's been one issue to another. 1st images refuses to load on time either to send to someone or to post on status. Tried deleting a status and to my surprise 5hrs later it's still processing to delete. As if that's not enough, contacts and those I think I blocked??? What's tf is wrong??? Infact this is total rubbish!!! Gutted.",1
Neo Angelo,"I have no issues with the app, though it took me a while to get acquainted with the recent updates, It's okay. However, I'd like to make a suggestion, during the next update, please can you enable us to be able to edit our status. Sometimes mistakes are made during posting and to correct those mistakes, it'll warrant us deleting and starting all over. Please add the editing of statuses. Thank you",4
Anahita Srivastava,"The app is very good when it comes to individual messaging, calling and document sharing. However, the forward feature only allows sending messages to only 5 people at a time which is highly inconvenient for people such as me who have multiple numbers of contacts we have to send messages to. So the change I would like to have in the upcoming update would be that we can forward our messages to as many people as we want and with this, our work will be made much easier as compared to how it is now.",3
Rebecca,"I’m having an issue where the music feature for posting statuses doesn’t show up, even after updating the app. I know this feature is available for others, but I’ve tried everything and it’s still missing for me. Hope this gets fixed soon because it’s a fun addition to status posts! Edit: still no change 😑",1
lila mehammed,"WhatsApp is an exceptional messaging app that keeps me connected with friends and family effortlessly . It's user - friendly interface makes sending messages, photos and videos a breeze . I appreciate the end -encryption, insuring my conversations remain private and secure . Group chats and voice/video calling features are fantastic for staying in touch with larger circles. Occasionally , I experience minor glitches or connectivity issues, but overall , WhatsApp remains my top choice.",5
Chris.,"The new update stinks. Trying to share a video or photo to someone and my status is tiresome and frustrating. I have to wait for the app to process several selected posts to share to my friends which can even take up to 20 minutes. The previous version was better, and no, it's not about my phone, it is perfectly fine. You're better than, aargh!! do better.",1
Charlie P,"After the recent update if I want to attach a picture to a message. It's 100 times more difficult. I have lots of albums in my phone. When I select the paperclip icon as usual in WhatsApp to attach a picture, I then select ""gallery"" as normal. It then shows ""recent"" photos first, which is normal. At that point, I always tap the down arrow to find the album I want with the picture in it I want to attach but, apart from recents, WhatsApp now only lets me select from 4 albums in my phone !!",1
Moeen Khan,"This app is great. However, I recommend one improvement. Whenever, I write something in search bar, click on any option; after that I want to go back to select another option; I have to write again in search bar. This is the issue. Search bar should keep the search list untill I intentionally escape. I hope you understand what am I trying to say.",4
Adefiju Adefiju,Could I even call it the worst Everyone call chat their friends and family but I am the only one left. Due to loss of accuracy occuring in the app. It has been so tiring I can't even explain without having emotion. Whatsapp is the most commonest app used in my country. So what choice do I have. It could even cause depression. Makes you left out of the communication world. Although it is the worst app I would recommend.🤔😩💢,1
06.OreRuault.6C,"Good app, very useful for everyday use and i recommend this app for every one who wants to be able to comunicate with family, friends, and others easily. but my suggestion for the whats app channel / saluran feature is to provide a ""remove follower"" feature so that channel owners can remove someone from their channel. Keep up the good work!",5
Saharsh Shah,"It would be really helpful if you added a feature where we can rename documents sent by others in such a way that its only visible to us and is easier to access. For example, if there is a college classroom group, and the teachers there send a lot of answerkeys or PDFs, but they dont name them appropriately or leave it as is. It's tough to locate the documents we need. So if we, as a user, were able to rename them for pur personal purposes (only visible to us), then that would be of great help!",4
Brendan Chong,It's getting more annoying when using the latest update. The more update it's get the more bug there is. When listening to voice msg the screen suddenly turn black and become ear speaker hearing. But when you put it near your ears it become loud speaker sound output. Another bug is that when we want to hear speaker sound it become freeze screen and you can't touch anything on the app itself. Unless you screen out. Is this happening to only specific phone brand.,3
Mohammad Alam,"Very nice app. Easy to chat etc. Meta Al is fantastic. From text messages to voice and video calls, WhatsApp makes it possible to communicate in almost every format imaginable. It's also incredibly versatile, offering features like group chats, file sharing, voice messages, and Status updates that keep users connected in different ways. For many, it's become the go-to app for both personal and professional communication. Despite its many advantages, WhatsApp isn't without its limitations.",4
Daniel Kioko,"I've been experiencing ongoing issues with WhatsApp where the app keeps stopping unexpectedly. Despite updating to the latest version, the problem persists. Every few hours or days, the app crashes and refuses to open, forcing me to uninstall and reinstall just to use it again. Even after reinstalling, the issue eventually returns. This is incredibly frustrating, especially since WhatsApp is a crucial communication tool. I’ve tried clearing the cache, restarting my phone.",1
Martin Jelínek,"Come on. Fix the issue with disappearing notifications already! When there are multiple msg notifications, they all disappear when you open one of them (or just whatsapp in general). Thats horrible UX design, no other major app has this issue. You HAVE to know about this so finally fix it. On my Pixel 9 pro, the issue started about 3 months ago. From what I read online, on iPhones its like that for maybe years now! What a hell is going on... It is serious UX design flaw.",1
