user,review,rating
Muhammad T Hussaini,"WhatsApp is an exceptional platform that seamlessly connects people across the globe, allowing friends and family to stay in touch effortlessly. Its simplicity, reliability, and user-friendly features make it indispensable for instant communication, whether through text, calls, or multimedia sharing. It’s more than an app—it’s a bridge that brings people closer.",5
Farros Muhammad althaf,"This app is absolutely fantastic, best messaging app ever. I've been using whatsapp for around 4 years, and, I have no issue with this app. It has tons of feature, such as text and voice messaging, voice and video call, status, locked chats, group chat, you can even link it to 4 seperate devices. Absolutely love this app.",5
Prasad Namani,Please add the feature of sending bunch of images to attach to the emails. Its been tough to send images received in whatsapp and sending as an attachment in emails by going back to gallery or file explorer(batch sending) Also.. driving mode in what's app for calls accepting and rejection option shall be introduced.. Send option - forward to list.. will be useful,4
Solar Light,"Installing this app on a new device still preventing from restore ""MY BACKUPS"", it does not present the option to do so. How limiting this is when I am unable to restory my data? No whatsapp data, MY DATA!!! Even after going through all the security hoops that are presented. Adding to it, there aren't options to backup/restore from NAS servers. It is limited to gdrive. Is it in busines Is seems this app is going to be just a waste of time.",1
Mark Nq. Chan,"App suddenly keeps crashing the moment I open the app. I'm unable to back up the data. I've tried multiple options of clearing cache and reinstalling, but app still keeps crashing. I'm using Samsung Galaxy S25 Ultra. Update 1: Uninstalled and tried to reinstall. App keeps crashing at login. Now I can't even use WhatsApp at all. Update 2: Current version on Google Play Store is not stable especially for Samsung Galaxy S25. I downloaded latest apk version to install and now it works.",1
Kamalesh,"I just wanted to take a moment to express my heartfelt gratitude for creating such an amazing messaging app. WhatsApp has made it incredibly easy for me to stay connected with my loved ones, friends, and family, no matter where they are in the world. The simplicity, reliability, and features of WhatsApp have made it an indispensable part of my daily life. From messaging and voice calls to video calls and file sharing, WhatsApp has revolutionized the way I communicate.",5
Chigozie Uzodinma,"It would be helpful if WhatsApp had a 'Close Friends Story/Status' just like Instagram does. It would be an awesome feature, because sometimes we don't want everyone to see our status and we don't like blocking everyone from seeing our status. So adding it as a feature on your next update would be spectacular. Also, let's be able to half swipe messages like we can on Snapchat",4
ruaa um 7ala,"The new update is very bad, you have spoiled the application that we liked In the new staple, the history of the conversations has changed to strange dates, for example 2031, 1989 or 1934, and he was forced to restart the phone each time until it is adjusted. Also, how to display stories differed and this is very bad, and the quality of the video in the case changes to the worse and long audio files cannot be sent",1
Lindo Lwazi,The best app one could have to communicate with loved ones far away from one's location and I personally love the privacy settings I'm able to include or exclude anyone who I don't want to see my status and profit picture keep updating because it will be a negative experience to see this app crash. Almost forgot about the picture quality setting it's a thing you have to see in other to believe. If you don't believe just press install.🙈❤,5
sandra O,"The recent way the status updates are being arranged is not nice. Initially, it was according to the time a particular contact posts a status update. It gave it this orderliness making it organized and all, but now, it all scattered and very disorganized. I do not like it at all. It'll be very nice if the status updates go back as it used to be.",4
Abdulrazak Abdulganiyu,"It's a great app, the developers should keep it up. Am looking forward to more great updates for this app. Thank you developers for this great app 👍👍👍. And one thing i noticed is that i wish the Meta AI could be able to locate your previous chats instead of scrolling up all the time which is a bit stressful so that one won't have to search or chat the same thing twice. I hope it can be done in newer updates.",5
C ML,"Caution on restoring backup or migrating phone. If you logged in on new device and it did not prompt to restore chat backup from google drive, exit immediately, clear cache and reinstall WhatsApp, otherwise your backup will be overridden with the current new phone, i.e. empty chat, and your old backup will be lost forever. It is hard to believe huge company still fail on basic design, override backup without warning, did not compare local and cloud before syncing data. Wth seriously!",1
Gabriel Volpe,The broadcast feature does not work. I guess they don't run any kind of tests against this feature before releasing because it never worked. I use this feature when I change number and I want to notify my contacts about it but then every single time I made use of it I found out that my contacts have never received any message from me. Fix it and I'll rate you back.,1
Mamta Chaurasiya,Worst storage and chat backup management. After I removed my second account... all my 6yrs of media files of primary account went missing and tried all sort of online help from official support option on app (which itself is no more than a Joke as the AI chatbot seem to be programmed to just answer very basic questions while actually just doesn't want to escalate to any human customer service representative). Also mail option seem to be handled by AI bot as well.As getting same repeat answer,1
Rama Tejaswi Maddala,"Suggest moving chats from businesses into a separate section. As number of business subscriptions grow, and they message unnecessary promotional offers frequently, it is distracting to intertwine their messages with personal chats. It would be nice to separate business chats from personal chats, into a distinct tab. Also could provide multiple channels for businesses so that we only subscribe to essential communication while turning off its other channels, much like mobile notifications.",3
x_ norvi,"WhatsApp, I love the convenience of having a dedicated Groups tab! However, I think it's time to take it to the next level. With the current setup, individual chats and group chats are mixed together in the main chat list, making it easy for individual messages to get lost in the noise. I'd love to see a separate tab or filter for individual chats, allowing me to easily access and prioritize my personal conversations. This feature would greatly improve my WhatsApp experience and make it easier",4
Parthasarathy L,"Hi Team, I'm using S24 Ultra. Wherever Whenever I get a call in whatapp (saved contact) it completely mutes my s24 ultra automatically. After that I never gets a ringtone. It changes the ringtone to silent mode. And it will never show the silent symbol also on the top. I have to manually change the mode. I tried reinstalling whatsapp, It is not resolved yet. All the notification and ringtone settings are good. No issues with that.",3
Vimal “vije” Bhatt,"Latest update has removed direct access from my media stored on the SD card. Before, when i was clicking attechment, it was letting me go to all the folders of my gallery storage(intrnal drive and external storage). It did started showing the full gallery albums few days ago for few days. Again it turn to only few albums from gallery to attach the media files in whatsapp masseges... very strange!!! This happens with my other android phones in the household too..!! Hope it turns normal soon.",1
kondwani kaira,"I love the fact that meta AI is friendly interfaced and how it gives accurate data. It has answers for everything. But I'd love it if it could predict the market range for every specific given time other than these other apps that are fake, just waste bundles.",5
Victor Olodeokuta,"My messages suddenly stopped getting sent. At first, I thought it was an issue with service in the area I was, I switched places ,yet it is still not sending messages, next I checked.my data balance, I do have data I can even browse the internet and right now I am using data to write this, but messages don't get sent. Please, help fix this problem.",1
Nabeeha,"Please give the users log out option on android. Sometimes, when a break is necessary, logging out of the app could be helpful. Other than that, please improve the quality of calls. Facing random call drops pretty often. Whatsapp used to be my go-to app for audio and video calls, but nowadays, the call quality is not up to the par. I hope these matters will be considered. Also make the live location sharing option available for all devices, not just the primary device!",3
Prinz Jones iii,"this recently updated version is so messed up!!! it bugs, you cant follow public figures on it anymore without an error message, you can't upload videos or images to your status, even the meta AI ,you cant send messages to the AI without an error notification !!! i was logged out of my account without any dammed reason (which has never happened before and i never violated their community guidelines).this version is the worst version of WhatsApp !!",2
afifah zulaikha,"I just wanted to reach out because I’ve been having an issue with some features on WhatsApp that I haven’t been able to access yet. Some of my friends have been able to use the ""songs in status"" feature and customize their WhatsApp themes, but I don't seem to have those options available on my app. I’ve tried restarting my app, making sure it’s updated to the latest version, and all that, but I still can’t see the features that others have. Pls recheck it for me.",1
Shanelle Ragbar,"Hate this new transfer chat thing. Have been using this app for years. Having issues transferring my data from my old phone to my new phone. I watched multiple videos and did exactly what they said, however, the qr code isn't scanning. The old way of transferring data from one phone to the other was way easier.",1
Imran,"The app itself is wonderful. I could easily communicate with my friends and family who aren't in the same country as me. However, voice message would mess my phone up. Everytime I tried to listen to one voice message, my screen would lag very badly, causing the voice message to stop.",4
sadaf siddiqi,It's the best app but the only thing I dislike about what's app (for Android) is that it doesn't allow to select the whole picture for applying for Display picture. The dimension is square. While on iPhone you can select whichever picture it will automatically adjust the whole pic while blurring the background. Fix this please!,3
Manos Magklis,"Since Android or Pixel devices don't seem to have 'Voice Isolation' as a system feature (like iOS devices do) I am going to blame Whatsapp for not implementing something similar, since Zoom on Android *does* have 'Auto noise suppression' and 'Personalized audio isolation' in its settings. The result is that if you are trying to place a call using wired headphones (regardless of the country, Wi-Fi or mobile network used) the other side hears every little noise in your background.",1
Peter Jones,Notifications do what they want. Whilst using my phone I saw a message notification pop up then disappeared before I got to tap or dismiss it. Essentially notifications do not work and I'm missing messages. Everything has been turned on. Off then back on. Cleared cache and storage. Uninstalled the app and reinstalled. Didn't work.,1
Nandini Abrol,"The recent update on WhatsApp has introduced some challenges that are impacting the user experience. 1. The bold text formatting option is not working properly while typing messages. This is a crucial feature for emphasizing certain points, and its unavailability makes communication less effective. 2. Writing messages under videos has become very difficult. The text box feels restricted or unresponsive, which makes it inconvenient to convey context or commentary on shared videos.",2
Olaoye Dupe,"This app has been the best app so far ...but lately after I started updating the app, I started having problems posting pictures and videos, it just goes blank or even takes almost 5 hours before the video delivers. For the status update, the arrangements has been worse, it's arrangement doesn't align anymore. Please you guys need to really stop forcing people to update their app, because the update has a lots of bugs that needs to be fixed , so please work on that!",2
Harendra Kumar,"I am describing about WhatsApp. It's a very good app but from a last few days, it is giving some lacks, like when I view to WhatsApp status of my contacts, it doesn't show them in a correct way. The upper and lower part is covered with the behind background of whatsapp and then it shows the status. And second I'm unable to share videos in file format such of about 500 to 700 mb. Overall it's good except of such these malfunctions.",3
Jathniel Alade,By far the best messaging app I've ever used. I don't believe that should be an argument. But I wish when I delete a message it didn't show that I deleted it. And I often forget to send messages so having to draft a message and schedule when it would automatically send on its own would be really helpful. But the app is great nevertheless.,5
Jithin Jose,"1. 'Mark as unread from here' option in chats. 2. Option to notify people that you've marked it for later. 3. Option to sort statuses by oldest, so that we can watch them all before it expires. 4. Automatic status change isn't needed (except for videos) we'll change it by touch. 5. Unavailable-days mode needed. 6. Scheduling messages. 7. Dark theme could've been pure black, not dark grey. Thumbs up 👍🏼 If you want this to be implemented.",2
Saptak Sarkar,"Recently it's giving me great user experience, but there is just one thing that I hate the most is that, in the status bar, if someone gave any type of statuses, they've just showed us the exact time when it was shared, like 5h ago, 10 minutes ago. I lowkey just hate it. Please bring back to normal, show us the exact time when the status is shared or someone showed our statuses.",4
Vechisalu Nukhu,"Terrible. As an app that is used all over India, especially one that's the staple for communication in the country, it's disappointing that the backup/transfer options don't work at all when switching to a new device. I can't count the number of times I've had to log in and out of my old phone trying to transfer chats to my new phone, while also dealing with the fact that my old phone was dealt with longer and longer wait times for verification options since transfer kept failing at 97%.",1
Mel Miranda,"When I upload videos to my status it uploads with audio not on time with the video itself, playback issue in other words and the photos and videos I upload to my status are also uploaded in a super low quality it's just pathetic. Channel updates get all bugged and you can't scroll through them, horrific experience with all the bugs this app has",1
Chidinma Emenugha,"I recently changed my phone and reinstalled the WhatsApp App. I noticed that I no longer have the option of choosing among files when responding to someone's chat with a particular media. Also, for an App that's regularly being updated, you'd think that the quality of photos and videos would have improved. Guess that's a major hassle for Team.",1
Mandy Grey (Mooncatxx),"Update said it was urgent , & current version of whats app HAD to be replaced. or the phone would not work. I immediately followed the instructions. Since new app installed my phone is glitchy as hell ,causing chaos on calls etc the new app shows it installed yesterday. Not, 30 mins ago its some stupid bubble theme for messages backdrop. Im concerned my phone has been infected. reliant on mobiles security alone. Till I get home Monday I'm Not impressed just very pissed off 😡",1
naz,"1. features are too late. 2. send status but the picture or video suddenly blurry 3. sometimes, people that I saved in my contact didn't show when I typed their name. It disappear and I had to do this all over again! 4. send status as annoying now, please bring back the separated albums for easy access to choose!",1
Aa,"Notifications have been broken for over 6 months now. It only delivers notifications silently without vibration, which has made me not notice countless messages. When I used the in-app support, the ticket was closed with no response. When I made another ticket weeks later there was an automated response essentially saying that the notification issues are ignored. Also no way to block creepy spam callers, they can only be muted.",1
TEVIN MOODLEY,"Generally good experience, having issues storing whatsapp chat backup over the years of use onto the device storage (Last backup 2021, very difficult to transfer everything to new device), please find a way to compact total app and all media storage files. Small suggestion for improvement: Allow for voice notes to be captioned while recording-would assist for faster, clearer communication and future reference for important information",4
angus,"You should remove the status thing where you can follow companies and all of that - it seems useless and is quite annoying. Also, you should be able to mute someone without any options. Just do it in one click. So their messages come through. You just don't get a notification or a sound. Maybe there should also be another option where you can decide if people can see if you're on WhatsApp or not. Other than that it's quite good.",5
E P,No Notifications on S24 Ultra. I'm so annoyed. This app worked great for years on iphone. After switching to a Samsung I realized it's the only app where notifications don't come up on the lock screen regardless of settings. Regardless of whether it's locked or unlocked. Very very frustrating. I have to tap my screen every time and then it only shows the tiny little whatsapp icon/bubble but not the actual messages. No idea when notifications are coming in or not.,2
Paula Rakowska,"The app logged me out randomly. After I logged back in, the app never recovered some messages and multimedia, so I lost them. This is very disappointing, unacceptable 😡 I tried contacting the support, they sent irrelevant answers, and the chat us an automatic bot, which does not provide any help. What a catastrophe.",1
Adam Toynton,HELP! Your app has really helped me stay in touch with my Mum and we share photos and messages every day. HOWEVER over the last few weeks when I write a message and attach a photograph only the photo is sent and the message disappears. It's a really frustrating little hiccup with the app and hope someone at WhatsApp is able to have a look at it as a Reddit forum shows that a lot of people are suffering from the same issue irrespective of whether they use an Android or Apple fone.,4
Raymond Wachaga,"Consider adding a reading bookmark feature in group chats. Some groups are really active and staying up to date in a single session can be a daunting task. Unfortunately the moment you open the group chat and read through a couple of messages then navigate out to another chat, all the messages you did not read are marked as read and you have to scroll back all the way up to where you left of, hoping something will look familiar.",4
ADIKWO NATHAN,"WhatsApp is a fantastic messaging app that combines simplicity with powerful features. It's perfect for staying connected with friends, family, and colleagues through texts, calls, and video chats. The end-to-end encryption ensures privacy, and features like group chats, status updates, and file sharing make communication seamless. Highly recommended!",4
bella,"There is a problem Ever since I updated the app, anytime I want to send a video to someone or my status.. there is always some extra minutes to the video. The exact place that the video is meant to end will then freeze meanwhile the other minutes of the video will keep playing. But the video will still be frozen. Please Whatsapp should do something about this.",3
David Moreira,"Forces you to give access to contacts so they can mine your data. Without it you can't backup, and easy to lose all of your chats and history due to error prone workload to transfer data to a new phone. For example if you log in ti WhatsApp on a new phone it will log you out of your original phone and ALL your chats are gone/inaccessible henceforth. If you accidentally uninstall WhatsApp on your phone, ALL your data is gone/inaccessible after you reinstall it since you don't have a backup.",1
Sausha,"I really like what's app and it's features. It easy to use, has encrypted messages, and allows you to use less data for calls. Plus you can video chat, attach files, call and delete your messages for both you and the other person if you make a mistake",4
Jason Sheffield,"👏Meta for including AI in this application. This essential app is known for its diverse, multimedia-rich formats and its immediate direct one-on-one and group chats. Users confidently use it knowing that messages are end-to-end encrypted keeping them private 👌. I suggest that new users be aware of the media-sharing. You can end up with everyone else's images from groups added to your own. Hopefully, in future updates, there will be enhanced ⚠️ warnings before confirming this option.",5
Md Samshe,"This is the best messaging app with top-notch security and seamless performance. It offers fast messaging, high-quality voice/video calls, and end-to-end encryption for privacy. Group chats, media sharing, status updates, and real-time location make communication effortless. Multi-device support lets you stay connected across platforms. Channels and communities enhance engagement. With regular updates and a user-friendly design, it’s perfect for personal and professional use. Highly recommended!",5
Lacie Tuliszewski,"Cannot even use the app because it kept getting stuck in initializing. When I tried deleting and re-downloading, I received the message that I was banned due to spam. When I tried to submit for review, it errored out. When I tried to submit a request through the website, it errored out. Totally frustrated",1
Rahul Barwar,"#videocall Use-Friendly Interface: WhatsApp’s interface is clean, simple, and easy to navigate, making it accessible for users of all ages. Group Chats: The app supports group messaging, making it easy to stay connected with family, friends, or colleagues. Groups can support up to 256 members. End-to-End Encryption: WhatsApp encrypts messages end-to-end, meaning no one, including WhatsApp itself, can read your messages.",5
Gabriel,"Whatsapp wants to have a gallery of its own instead of relying on the system but can't do the job done in the slightest. Who even greenlit this. Why did you first hide the gallery button, then now remove it altogether. I gave permission to full access and yet it only sees four folders. What do you think am I gonna do with a ""cloud media app"" button? I can't send photos to people! Also it's 2025, let us crop videos in the editor, the technology is there.",1
mukthaar goolam,"It works perfectly fine but since this month, I experienced that if I don't go into the application, no messages show on the notification panel. Second issue I have is when I read a message after going into the application the notification panel still shows the notifications, so I need to manually swipe notifications on the panel after they are read and responded to. Last issue when you double click someone's profile picture it opens either previous conversation or locked chats folder.",3
Jacita Iwuoma,very okay and good service provider.easy to access. educational and always available. reduce work load. help for contact connection. strength forward answers. correct ones mistakes. fast and does not delays ones demands. No cost attached to everyday use. it's good. it's worldly use. No limitations in answering questions. provide service all the time. Does not disappoint. its awesome. it's wonderful. it's highly recommended by the entire world. thank you so much for giving us Whatsapp.,5
Muddassir Iqbal,"I hope this message finds you well. I recently purchased a Google Pixel 9 Pro XL, and I am experiencing an issue with WhatsApp audio calls. When I make an audio call and WhatsApp is on my screen, the other party can hear me perfectly. However, when WhatsApp is running in the background and another app is in the foreground, the other party cannot hear me. Bringing WhatsApp back to the screen resolves the issue temporarily.",1
Arup Majumder,"WhatsApp is not working with the new Samsung Galaxy S25 Ultra. It's unable to restore chat from Google back up. Stopped at 69% and showed an error. Tried the chat transfer option, and it didn't work either. It stopped at 97% and showed an error. Same backup, did work without issue in 4 other different Android devices from 3 different companies. Issue definitely between Whatsapp and Samsung S25 Ultra.",1
